{
  "$schema": "./skills.manifest.schema.json",
  "schemaVersion": 1,
  "sourceOfTruth": "SKILL.md frontmatter is runtime-canonical for name, description, and triggers. This manifest mirrors those fields for tooling and CI lint only.",
  "defaults": {
    "routerByteBudget": 12,
    "payloadBudget": 80000,
    "claudeSymlinkRequired": true,
    "downstreamDocsTargets": [
      "learn/agentos/ProgressiveDisclosureSkills.md",
      "learn/guides/fundamentals/CodebaseOverview.md"
    ]
  },
  "skills": {
    "architecture-pre-flight": {
      "name": "architecture-pre-flight",
      "description": "High-level umbrella router for navigating broad, cross-substrate architectural ambiguity.",
      "triggers": "Use when no narrower pre-flight clearly applies, or when work spans multiple trigger families such as new subsystems, protocols, MCP tools, or cross-substrate refactors.",
      "routerByteBudget": 12,
      "payloadBudget": 80000,
      "claudeSymlinkRequired": true,
      "downstreamDocsTargets": [
        "learn/agentos/ProgressiveDisclosureSkills.md",
        "learn/guides/fundamentals/CodebaseOverview.md"
      ]
    },
    "blocked-task-state": {
      "name": "blocked-task-state",
      "description": "Authoritative protocol for signaling blocked or input-required task states. Mandates targeted A2A pings using the Task.state envelope rather than global capacity broadcasts.",
      "triggers": "Use this skill whenever your execution becomes blocked, requires explicit operator input, or encounters a failure that halts progress.",
      "routerByteBudget": 12,
      "payloadBudget": 80000,
      "claudeSymlinkRequired": true,
      "downstreamDocsTargets": [
        "learn/agentos/ProgressiveDisclosureSkills.md",
        "learn/guides/fundamentals/CodebaseOverview.md"
      ]
    },
    "create-skill": {
      "name": "create-skill",
      "description": "Authoritative guide on how to architect, format, and structure new Anthropic Progressive Disclosure skills.",
      "triggers": "Use this skill if the user asks you to create a new skill, teach an agent a new capability, or if you need to recall the exact folder structure and YAML frontmatter required for skills.",
      "routerByteBudget": 12,
      "payloadBudget": 80000,
      "claudeSymlinkRequired": true,
      "downstreamDocsTargets": [
        "learn/agentos/ProgressiveDisclosureSkills.md",
        "learn/guides/fundamentals/CodebaseOverview.md"
      ]
    },
    "debugging-antigravity": {
      "name": "debugging-antigravity",
      "description": "Authoritative guide on debugging Antigravity IDE MCP servers, preventing language server duplication, mitigating sqlite workspace UI crashes, and configuring mcpServers.",
      "triggers": "Use this skill if the user's Antigravity MCP server panel has a perpetual loading spinner, if MCP processes are duplicating, if sqlite workspace states are corrupted (`__store` null error), or if you need to know how to properly scope `.gemini/settings.json` vs global configurations.",
      "routerByteBudget": 12,
      "payloadBudget": 80000,
      "claudeSymlinkRequired": false,
      "downstreamDocsTargets": [
        "learn/agentos/ProgressiveDisclosureSkills.md",
        "learn/guides/fundamentals/CodebaseOverview.md"
      ]
    },
    "epic-resolution": {
      "name": "epic-resolution",
      "description": "Closeout protocol for parent epics — answers \"we resolved all epic subs, are we done now?\" with a structured matrix + verdict recommendation (close / keep open / create missing subs / retire-supersede). Sibling to epic-review (which handles entry); this is the exit gate.",
      "triggers": "Use this skill when the last required sub of an epic closes, when a team member claims an epic is complete or substrate-side complete, before closing an epic as COMPLETED, or when a peer broadcasts an epic-readiness signal that needs reconciliation against parent ACs.",
      "routerByteBudget": 12,
      "payloadBudget": 80000,
      "claudeSymlinkRequired": true,
      "downstreamDocsTargets": [
        "learn/agentos/ProgressiveDisclosureSkills.md",
        "learn/guides/fundamentals/CodebaseOverview.md"
      ]
    },
    "epic-review": {
      "name": "epic-review",
      "description": "Authoritative protocol for pre-work review of epics. Five-stage gating chain — roadmap fit, approach elegance, sub-structure coherence, prescription layer, avoided-traps completeness — posted as a structured comment on the epic ticket. Per-agent-per-epic one-shot; subsequent sub pickups cite the prior review.",
      "triggers": "Use this skill when an agent is about to pick up its first sub from an unreviewed epic (per model-identity). Also use when a user explicitly requests an epic review, or when an epic is freshly filed and a reviewer pre-validates before any sub pickup begins.",
      "routerByteBudget": 12,
      "payloadBudget": 80000,
      "claudeSymlinkRequired": true,
      "downstreamDocsTargets": [
        "learn/agentos/ProgressiveDisclosureSkills.md",
        "learn/guides/fundamentals/CodebaseOverview.md"
      ]
    },
    "ideation-sandbox": {
      "name": "ideation-sandbox",
      "description": "Safely propose architectural features, unknown unknowns, and brainstorm ideas natively in GitHub Discussions.",
      "triggers": "Use this skill when the user asks to brainstorm an architecture change or proposes a highly exploratory / undefined technical idea.",
      "routerByteBudget": 12,
      "payloadBudget": 80000,
      "claudeSymlinkRequired": true,
      "downstreamDocsTargets": [
        "learn/agentos/ProgressiveDisclosureSkills.md",
        "learn/guides/fundamentals/CodebaseOverview.md"
      ]
    },
    "industry-friction-radar": {
      "name": "industry-friction-radar",
      "description": "Proactive Bleeding-Edge research loop using a strict 3-step abstraction protocol to extract engine-category friction points without importing framework-category bias or stealing code.",
      "triggers": "Use this skill when executing periodic \"horizon scans\" for the Dream Pipeline, researching external solutions to deeply complex engine-level friction points, or evaluating JS ecosystem trends.",
      "routerByteBudget": 12,
      "payloadBudget": 80000,
      "claudeSymlinkRequired": true,
      "downstreamDocsTargets": [
        "learn/agentos/ProgressiveDisclosureSkills.md",
        "learn/guides/fundamentals/CodebaseOverview.md"
      ]
    },
    "lead-role": {
      "name": "lead-role",
      "description": "Switch into relaxed-planning + dialogue-first mindset when delegated lead role for coordination. Suspends Auto Mode velocity-bias for the duration.",
      "triggers": "Use this skill IMMEDIATELY when the user delegates lead with explicit phrases (\"you take the lead\", \"coordinate the team\", \"lead this phase\", \"drive the next planning step\", \"chief-architect\" when scope is swarm/substrate/roadmap/multi-ticket), OR when AGENTS.md §22 mailbox check surfaces a valid `lead-role-baton`, OR when you have just authored a substrate-shaped ticket about to enter implementation, OR via direct /lead-role invocation.",
      "routerByteBudget": 15,
      "payloadBudget": 80000,
      "claudeSymlinkRequired": true,
      "downstreamDocsTargets": [
        "learn/agentos/ProgressiveDisclosureSkills.md",
        "learn/guides/fundamentals/CodebaseOverview.md"
      ]
    },
    "memory-mining": {
      "name": "memory-mining",
      "description": "Authoritative protocol for querying the Memory Core before diagnosing regressions or proposing non-trivial architectural claims. Prevents re-derivation of prior reasoning by surfacing cross-session, cross-harness context via semantic search.",
      "triggers": "Use this skill when (1) the user reports a regression symptom (\"used to work\", \"suddenly broken\", surprise validation failures, schema mismatches, \"additionalProperties\" rejections), OR (2) you are about to propose an architectural claim, roadmap, or comparison against external work where prior sessions may have already mapped the territory.",
      "routerByteBudget": 12,
      "payloadBudget": 80000,
      "claudeSymlinkRequired": true,
      "downstreamDocsTargets": [
        "learn/agentos/ProgressiveDisclosureSkills.md",
        "learn/guides/fundamentals/CodebaseOverview.md"
      ]
    },
    "neural-link": {
      "name": "neural-link",
      "description": "Expert tactical knowledge on sequencing Neural Link MCP tools to inspect, debug, and manipulate live Neo.mjs applications.",
      "triggers": "Use this skill if the user asks you to interact with the browser, inspect the UI natively, patch live code, or use the Neural Link.",
      "routerByteBudget": 12,
      "payloadBudget": 80000,
      "claudeSymlinkRequired": true,
      "downstreamDocsTargets": [
        "learn/agentos/ProgressiveDisclosureSkills.md",
        "learn/guides/fundamentals/CodebaseOverview.md"
      ]
    },
    "peer-role": {
      "name": "peer-role",
      "description": "Switch into evidence-backed convergence-pressure mindset when reviewing a peer's design proposal. Suspends Auto Mode \"ack-and-move-on\" bias for the duration.",
      "triggers": "Use this skill IMMEDIATELY when reviewing an Ideation Sandbox discussion / architectural proposal, an epic shape, a skill shape, a roadmap or milestone proposal, or a `/lead-role` convergence artifact. Do NOT auto-fire on ordinary status broadcasts where the right action is mark-read or \"no collision\".",
      "routerByteBudget": 15,
      "payloadBudget": 80000,
      "claudeSymlinkRequired": true,
      "downstreamDocsTargets": [
        "learn/agentos/ProgressiveDisclosureSkills.md",
        "learn/guides/fundamentals/CodebaseOverview.md"
      ]
    },
    "post-review-pickup": {
      "name": "post-review-pickup",